{
    "name": "Li Mingxuan",
    "business_name": "Star River Design Studio",
    "individual_sole_proprietor": false,
    "c_corporation": false,
    "s_corporation": true,
    "partnership": false,
    "trust_estate": false,
    "llc": false,
    "llc_classification": null,
    "exempt_payee_code": null,
    "other": false,
    "other_entity_type": null,
    "fatca_exemption_code": "E",
    "foreign_partners": false,
    "address": "1288 Maple Ridge Drive",
    "city_state_zip": "Brooklyn, NY 11221",
    "requester_name_address": null,
    "account_numbers": null,
    "ssn_part_1": "591",
    "ssn_part_2": "34",
    "ssn_part_3": "8027",
    "ein_part_1": "27",
    "ein_part_2": "8451936"
}